{
  "$schema": "https://json-schema.org/draft/2020-12/schema",
  "title": "tests/dbspec/ddl.json",
  "description": "The DDL vectors: each case's documents, the statements each dialect creates them with, and the behavior those statements give (a statement that runs or fails, a query and its value), optionally limited to some dialects.",
  "type": "object",
  "additionalProperties": false,
  "required": [
    "requirements",
    "version",
    "note",
    "cases"
  ],
  "properties": {
    "requirements": {
      "description": "The requirement ids of docs/spec that the cases of each section test, read by the parity check of @polyspec/kit (R15) and by no runner.",
      "type": "object",
      "additionalProperties": false,
      "required": [
        "cases"
      ],
      "properties": {
        "cases": {
          "type": "array",
          "minItems": 1,
          "uniqueItems": true,
          "items": {
            "type": "string",
            "pattern": "^[A-Z]+-[0-9]+$"
          }
        }
      }
    },
    "version": {
      "const": 1
    },
    "note": {
      "type": "string"
    },
    "cases": {
      "type": "array",
      "minItems": 1,
      "items": {
        "type": "object",
        "additionalProperties": false,
        "required": [
          "id",
          "documents",
          "statements",
          "behavior"
        ],
        "properties": {
          "id": {
            "type": "string"
          },
          "documents": {
            "$ref": "#/$defs/documents"
          },
          "statements": {
            "type": "object",
            "additionalProperties": false,
            "required": [
              "mysql",
              "postgres",
              "sqlite"
            ],
            "properties": {
              "mysql": {
                "$ref": "#/$defs/lines"
              },
              "postgres": {
                "$ref": "#/$defs/lines"
              },
              "sqlite": {
                "$ref": "#/$defs/lines"
              }
            }
          },
          "behavior": {
            "type": "array",
            "items": {
              "$ref": "#/$defs/behavior"
            }
          }
        }
      }
    }
  },
  "$defs": {
    "lines": {
      "type": "array",
      "items": {
        "type": "string"
      }
    },
    "documents": {
      "type": "object",
      "additionalProperties": {
        "$ref": "#/$defs/lines"
      }
    },
    "behavior": {
      "type": "object",
      "additionalProperties": false,
      "required": [],
      "properties": {
        "sql": {
          "type": "string"
        },
        "query": {
          "type": "string"
        },
        "want": {
          "type": "string"
        },
        "fails": {
          "const": true
        },
        "dialects": {
          "type": "array",
          "minItems": 1,
          "items": {
            "enum": [
              "mysql",
              "postgres",
              "sqlite"
            ]
          }
        }
      },
      "oneOf": [
        {
          "required": [
            "sql"
          ],
          "properties": {
            "sql": {
              "type": "string"
            }
          }
        },
        {
          "required": [
            "query"
          ],
          "properties": {
            "query": {
              "type": "string"
            }
          }
        }
      ]
    }
  }
}
