{
  "requirements": {
    "cases": ["DBS-35", "DBS-37", "DBS-41", "DBS-84", "DBS-88", "DBS-90", "DBS-91", "DBS-92", "DBS-93", "DBS-95", "DBS-96", "DIA-25", "DIA-28", "DIA-30", "DIA-113", "DIA-114", "DIA-115", "DIA-116", "DIA-117", "DIA-118", "DIA-119", "DIA-120", "DIA-121", "DIA-122", "DIA-123", "DIA-124", "DIA-125", "DIA-126", "DIA-127", "DIA-128", "DIA-129", "DIA-130", "DIA-131", "DIA-132"]
  },
  "version": 1,
  "note": "Each case parses every listed document against the others; statements lists, per dialect, the statements that Render writes for the document set in order. behavior steps run in order after the statements: sql must succeed, or fail when fails is true; query must return want as text. A step with dialects runs only on those dialects.",
  "cases": [
    {
      "id": "types-and-defaults",
      "documents": {
        "shop": [
          "dbspec 1 shop",
          "",
          "table kinds {",
          "  id i64 identity",
          "  small i16 default 1",
          "  medium i32 null",
          "  large i64 default -5",
          "  flag bool default true",
          "  price decimal(13,2) default 7.50",
          "  ratio f64 default 1.5",
          "  code varchar(16) default 'a\\b''c'",
          "  body text null",
          "  data bytes null",
          "  token uuid null",
          "  day date default '2026-01-01'",
          "  clock time(3) null",
          "  noon time(0) default '12:00:00'",
          "  stamp datetime(6) default now",
          "  second datetime(0) default now",
          "  milli datetime(3) default now",
          "  primary key (id)",
          "}"
        ]
      },
      "statements": {
        "mysql": [
          "CREATE TABLE `kinds` (`id` BIGINT NOT NULL AUTO_INCREMENT, `small` SMALLINT NOT NULL DEFAULT 1, `medium` INT NULL, `large` BIGINT NOT NULL DEFAULT -5, `flag` tinyint(1) NOT NULL DEFAULT 1, `price` DECIMAL(13,2) NOT NULL DEFAULT 7.50, `ratio` DOUBLE NOT NULL DEFAULT 1.5, `code` varchar(16) CHARACTER SET utf8mb4 COLLATE utf8mb4_0900_bin NOT NULL DEFAULT 'a\\\\b''c', `body` LONGTEXT CHARACTER SET utf8mb4 COLLATE utf8mb4_0900_bin NULL, `data` LONGBLOB NULL, `token` char(36) CHARACTER SET ascii COLLATE ascii_bin NULL, `day` DATE NOT NULL DEFAULT '2026-01-01', `clock` TIME(3) NULL, `noon` TIME(0) NOT NULL DEFAULT '12:00:00', `stamp` DATETIME(6) NOT NULL DEFAULT CURRENT_TIMESTAMP(6), `second` DATETIME(0) NOT NULL DEFAULT CURRENT_TIMESTAMP(0), `milli` DATETIME(3) NOT NULL DEFAULT CURRENT_TIMESTAMP(3), PRIMARY KEY (`id`), CONSTRAINT `kinds$flag` CHECK (`flag` IN (0, 1)), CONSTRAINT `kinds$token` CHECK (REGEXP_LIKE(`token`, '^[0-9a-f]{8}-[0-9a-f]{4}-[0-9a-f]{4}-[0-9a-f]{4}-[0-9a-f]{12}$', 'c')), CONSTRAINT `kinds$clock` CHECK (`clock` >= '00:00:00' AND `clock` < '24:00:00'), CONSTRAINT `kinds$noon` CHECK (`noon` >= '00:00:00' AND `noon` < '24:00:00')) ENGINE=InnoDB DEFAULT CHARSET=utf8mb4 COLLATE=utf8mb4_0900_bin"
        ],
        "postgres": [
          "CREATE TABLE \"kinds\" (\"id\" bigint GENERATED BY DEFAULT AS IDENTITY NOT NULL, \"small\" smallint NOT NULL DEFAULT 1, \"medium\" integer NULL, \"large\" bigint NOT NULL DEFAULT -5, \"flag\" boolean NOT NULL DEFAULT TRUE, \"price\" numeric(13,2) NOT NULL DEFAULT 7.50, \"ratio\" double precision NOT NULL DEFAULT 1.5, \"code\" varchar(16) COLLATE \"C\" NOT NULL DEFAULT 'a\\b''c', \"body\" text COLLATE \"C\" NULL, \"data\" bytea NULL, \"token\" uuid NULL, \"day\" date NOT NULL DEFAULT '2026-01-01', \"clock\" time(3) NULL, \"noon\" time(0) NOT NULL DEFAULT '12:00:00', \"stamp\" timestamp(6) NOT NULL DEFAULT statement_timestamp(), \"second\" timestamp(0) NOT NULL DEFAULT statement_timestamp(), \"milli\" timestamp(3) NOT NULL DEFAULT statement_timestamp(), PRIMARY KEY (\"id\"), CONSTRAINT \"kinds$clock\" CHECK (\"clock\" < '24:00:00'), CONSTRAINT \"kinds$noon\" CHECK (\"noon\" < '24:00:00'))"
        ],
        "sqlite": [
          "CREATE TABLE \"kinds\" (\"id\" INTEGER NOT NULL PRIMARY KEY AUTOINCREMENT, \"small\" smallint NOT NULL DEFAULT 1, \"medium\" integer NULL, \"large\" bigint NOT NULL DEFAULT -5, \"flag\" BOOLEAN NOT NULL DEFAULT 1, \"price\" DECIMALINT(13,2) NOT NULL DEFAULT 750, \"ratio\" REAL NOT NULL DEFAULT 1.5, \"code\" varchar(16) NOT NULL DEFAULT 'a\\b''c', \"body\" TEXT NULL, \"data\" BLOB NULL, \"token\" TEXT NULL, \"day\" DATE NOT NULL DEFAULT '2026-01-01', \"clock\" TIME NULL, \"noon\" TIME NOT NULL DEFAULT '12:00:00', \"stamp\" DATETIME NOT NULL DEFAULT (strftime('%Y-%m-%d %H:%M:%f', 'now') || '000'), \"second\" DATETIME NOT NULL DEFAULT (strftime('%Y-%m-%d %H:%M:%S', 'now')), \"milli\" DATETIME NOT NULL DEFAULT (substr(strftime('%Y-%m-%d %H:%M:%f', 'now'), 1, 23)), CONSTRAINT \"kinds$small\" CHECK (typeof(\"small\") IN ('integer', 'null') AND \"small\" BETWEEN -32768 AND 32767), CONSTRAINT \"kinds$medium\" CHECK (typeof(\"medium\") IN ('integer', 'null') AND \"medium\" BETWEEN -2147483648 AND 2147483647), CONSTRAINT \"kinds$large\" CHECK (typeof(\"large\") IN ('integer', 'null')), CONSTRAINT \"kinds$flag\" CHECK (\"flag\" IN (0, 1)), CONSTRAINT \"kinds$price\" CHECK (typeof(\"price\") IN ('integer', 'null') AND \"price\" BETWEEN -9999999999999 AND 9999999999999), CONSTRAINT \"kinds$ratio\" CHECK (typeof(\"ratio\") IN ('real', 'null')), CONSTRAINT \"kinds$code\" CHECK (length(\"code\") <= 16), CONSTRAINT \"kinds$token\" CHECK (\"token\" GLOB '[0-9a-f][0-9a-f][0-9a-f][0-9a-f][0-9a-f][0-9a-f][0-9a-f][0-9a-f]-[0-9a-f][0-9a-f][0-9a-f][0-9a-f]-[0-9a-f][0-9a-f][0-9a-f][0-9a-f]-[0-9a-f][0-9a-f][0-9a-f][0-9a-f]-[0-9a-f][0-9a-f][0-9a-f][0-9a-f][0-9a-f][0-9a-f][0-9a-f][0-9a-f][0-9a-f][0-9a-f][0-9a-f][0-9a-f]'), CONSTRAINT \"kinds$day\" CHECK (\"day\" IS date(\"day\")), CONSTRAINT \"kinds$clock\" CHECK (length(\"clock\") = 12 AND substr(\"clock\", 1, 8) IS time(substr(\"clock\", 1, 8)) AND substr(\"clock\", 1, 8) < '24:00:00' AND substr(\"clock\", 9, 1) = '.' AND substr(\"clock\", 10) GLOB '[0-9][0-9][0-9]'), CONSTRAINT \"kinds$noon\" CHECK (\"noon\" IS time(\"noon\") AND \"noon\" < '24:00:00'), CONSTRAINT \"kinds$stamp\" CHECK (length(\"stamp\") = 26 AND substr(\"stamp\", 1, 19) IS datetime(substr(\"stamp\", 1, 19)) AND substr(\"stamp\", 12, 2) < '24' AND substr(\"stamp\", 20, 1) = '.' AND substr(\"stamp\", 21) GLOB '[0-9][0-9][0-9][0-9][0-9][0-9]'), CONSTRAINT \"kinds$second\" CHECK (length(\"second\") = 19 AND \"second\" IS datetime(\"second\") AND substr(\"second\", 12, 2) < '24'), CONSTRAINT \"kinds$milli\" CHECK (length(\"milli\") = 23 AND substr(\"milli\", 1, 19) IS datetime(substr(\"milli\", 1, 19)) AND substr(\"milli\", 12, 2) < '24' AND substr(\"milli\", 20, 1) = '.' AND substr(\"milli\", 21) GLOB '[0-9][0-9][0-9]'))"
        ]
      },
      "behavior": [
        {
          "sql": "INSERT INTO kinds (medium) VALUES (NULL)"
        },
        {
          "query": "SELECT code FROM kinds",
          "want": "a\\b'c"
        },
        {
          "query": "SELECT price FROM kinds",
          "want": "7.50",
          "dialects": [
            "mysql",
            "postgres"
          ]
        },
        {
          "query": "SELECT price FROM kinds",
          "want": "750",
          "dialects": [
            "sqlite"
          ]
        },
        {
          "query": "SELECT length(stamp) || ' ' || length(second) || ' ' || length(milli) FROM kinds",
          "want": "26 19 23",
          "dialects": [
            "sqlite"
          ]
        },
        {
          "sql": "INSERT INTO kinds (clock) VALUES ('12:00:00.123')"
        },
        {
          "sql": "INSERT INTO kinds (small) VALUES (40000)",
          "fails": true
        },
        {
          "sql": "INSERT INTO kinds (flag) VALUES (2)",
          "fails": true
        },
        {
          "sql": "INSERT INTO kinds (token) VALUES ('not-a-uuid')",
          "fails": true
        },
        {
          "sql": "INSERT INTO kinds (noon) VALUES ('24:00:00')",
          "fails": true
        },
        {
          "sql": "INSERT INTO kinds (ratio) VALUES ('abc')",
          "fails": true
        },
        {
          "sql": "INSERT INTO kinds (clock) VALUES ('12:00:00')",
          "fails": true,
          "dialects": [
            "sqlite"
          ]
        },
        {
          "sql": "INSERT INTO kinds (stamp) VALUES ('2026-01-01 24:00:00.000000')",
          "fails": true,
          "dialects": [
            "mysql",
            "sqlite"
          ]
        },
        {
          "sql": "INSERT INTO kinds (stamp) VALUES ('2026-01-01 24:00:00.000000')",
          "dialects": [
            "postgres"
          ]
        },
        {
          "query": "SELECT count(*) FROM kinds WHERE stamp = '2026-01-02 00:00:00'",
          "want": "1",
          "dialects": [
            "postgres"
          ]
        },
        {
          "sql": "INSERT INTO kinds (price) VALUES (1.5)",
          "fails": true,
          "dialects": [
            "sqlite"
          ]
        }
      ]
    },
    {
      "id": "keys-indexes-foreign-keys",
      "documents": {
        "shop": [
          "dbspec 1 shop",
          "",
          "table orders {",
          "  id i64 identity",
          "  user_id i64 null",
          "  code varchar(8)",
          "  placed_at datetime(6)",
          "  primary key (id)",
          "  unique uq_orders_code (code)",
          "  index ix_orders_placed (placed_at desc, code)",
          "  index ix_orders_user (user_id)",
          "  foreign key fk_orders_user (user_id) references users (id) on delete set_null on update cascade",
          "}",
          "",
          "table users {",
          "  id i64 identity",
          "  email varchar(64)",
          "  primary key (id)",
          "  unique uq_users_email (email)",
          "}",
          "",
          "table pairs {",
          "  a i32",
          "  b i32",
          "  note varchar(8) null",
          "  primary key (a, b)",
          "  index ix_pairs_note (note)",
          "}"
        ]
      },
      "statements": {